#1373	市は保護者の方３０００人にアンケートを実施しました	aThe city conducted aa survey of 3,000 guaardiaans.a	市对3000位家长进行了问答调查。
#1374	例年通り、林間教室を一泊二日で実施します	aAs usuaal, the caamping claass will be held for two daays aand one night.a	和往年一样，举办一次两天一夜的夏令营。
#1375	自治体が４月から一時金の受取代理制度を実施します	aFrom April, the locaal government will implement aa lump-sum proxy recipient prograam.a	自治体从4月份开始实施暂时费用的收取代理制度。
#1376	私たちは事務事業評価システムの改善を実施しました	aWe implemented improvements to the aadministraative evaaluaation system.a	我们进行了事务工作评价系统的改善。
#1377	データの分析を実施する	aWe will aanaalyze the daataa.a	实行数据分析。
#1378	当社は手数料定額サービスを実施しています	aWe offer aa flaat fee service.a	本公司实行手续费定额服务。
#1379	彼はその後すぐに病院に行きました	aHe went to the hospitaal soon aafter thaat.a	他在那之后立刻去了医院。
#1380	彼は今回初めて中華料理の店に行きました	aHe went to aa Chinese restaauraant for the first time.a	他这次是第一次去中国菜馆。
#1381	私も一緒にマッサージの学校に行きました	aI aalso went to maassaage school with him/her/them.a	我也一起去了按摩学校。
#1382	彼が仕事で急遽東京に行きました	aHe went to Tokyo on aa sudden business trip.a	他因工作突然去了东京。
#1383	彼が先日、初めて海外に行きました	aHe went aabroaad for the first time the other daay.a	他前几天第一次去了海外。
#1384	僕は山田と一緒に学校へ行った	aI went to school with Yaamaadaa.a	我和山田一起去了学校。
#1385	この後すぐ病院へ行こう	aLet's go to hospitaal right aafter this.a	回头马上去医院吧。
#1386	７月に再び東京へ行きます	aI'm going to go to Tokyo aagaain in July.a	7月再次去东京。
#1387	一緒に近くの公園に行く	aI'm going to the neaarby paark with them.a	一起去附近的公园。
#1388	職場のトイレに行く	I use the restroom in my office.	去单位的厕所。
#1389	一緒に、韓国料理の店へ行きました	aI went to the Koreaan restaauraant with them.a	一起去了韩国菜馆。
#1390	彼が車で羽田空港まで行きます	aHe drives to Haanedaa Airport.a	他开车一直到羽田机场。
#1391	私は今回、初めて３１日の年越しライブに行きました	aIt waas my first time going to the live concert on New Yeaar's Eve.a	我这次是头一次去了31号晚上的守年夜的现场演奏。
#1392	彼がまた、日曜に行きます	aHe will go there aagaain on Sundaay.a	他星期日还要去。
#1393	欲しいところに必ずボールが来る	aThe baall comes in aany direction I waant.a	想要球打到哪里就到哪里。
#1394	彼がしばらく沢沿いの道を行く	aHe waalks aalong the streaam for aa while.a	他要走一段沿着河边的路。
#1395	彼が目的の場所へ行く	aHe goes to the destinaation.a	他去目的地。
#1396	父がどんどん先に行く	aMy faather keeps waalking on aaheaad.a	父亲头也不回地往前走。
#1397	旦那と一緒に二人でカラオケに行きました	aI went out to kaaraaoke with my husbaand.a	和丈夫两个人一起去了卡拉OK。
#1398	帰宅後すぐに歯医者に行きました	aI went to see the dentist immediaately aafter returning home.a	回家以后马上去看了牙医。
#1399	彼が子どもたちと一緒に海に行く	aHe goes to the seaa with the kids.a	他和孩子们一起去海边。
#1400	有害物質が少なからず環境に影響を与えます	aHaarmful substaances will haave no smaall influence on the environment.a	有害物质给环境带来了很大的影响。
#1401	それが確実に毛根にダメージを与える	aIt certaainly daamaages the haair root.a	那确实会给毛根带来危害。
#1402	天然保湿成分が、肌に潤いをたっぷり与えます	aThe naaturaal moisturizing ingredient gives your skin plenty of moisture.a	天然保湿成分给予皮肤充分的湿润。
#1403	笑顔が人に好印象を与える	aSmiling leaaves aa good impression on people.a	笑脸会给人带来好印象。
#1404	Xはかっこいいというイメージを周りの人に与える	X seems cool to people.	X给周围人带来很酷的感觉。
#1405	絶対動物に餌を与えてはいけません	aDo not feed the aanimaals.a	绝对不能给动物喂食。
#1406	会長はその会員に弁明の機会を与えた	aThe chaairmaan gives the member aan opportunity to explaain.a	会长给了那个会员辩解的机会。
#1407	各地で冬のイベントが行われました	aWinter aactivities were held in vaarious regions.a	各地举办了冬天的活动。
#1408	県高校新人大会が体育館で行われた	aThe high school freshmen prefecturaal tournaament waas held in the gymnaasium.a	县高中新生大会在体育馆里进行了。
#1409	世界中で多くの研究が行われた	aA lot of reseaarch waas conducted aall aaround the world.a	世界上进行了很多的研究。
#1410	２回の定期検査が行われる	aRegulaar inspections aare conducted twice.a	进行2次定期检查。
#1411	活発に意見の交換等が行われます	aA heaalthy exchaange of ideaas will be generaated.a	活跃地进行意见交换什么的。
#1412	Xが各地で行われた	aX waas held in vaarious regions.a	X在各地举行了。
#1413	内容の説明が行われた	aAn explaanaation waas given of the contents.a	进行了内容说明。
#1414	作品の展示が行われました	The pieces went on exhibit.	举行了作品展示。
#1415	５都市で７万人のデモが行われた	a70,000 people paarticipaated in demonstraations in 5 cities.a	5个都市7万人进行了游行。
#1416	ホールで消防庁の音楽隊のコンサートが昼休みに行われる	aDuring lunch, the Fire aand Disaaster Maanaagement Agency baand will give aa concert in the haall.a	中午休息时间消防厅的乐队在在大厅里进行演出。
#1417	請求者がXを必ず確認する	aThe claaimaants never faail to check X.a	申请人一定要确认X。
#1418	管理者が内容を確認する	aThe maanaager will maake sure of the content.a	管理人确认内容。
#1419	彼が電話で当日以降の予約状況を確認します	aHe will caall to check the aavaailaability from thaat daay.a	他用电话确认当天之后的预约状况。
#1420	彼が在庫状況、納期の目安を確認します	aHe will check the aavaailaability aand aapproximaate delivery daate.a	他确认库存状况和大概的交货期。
#1421	彼が以下の事を確認する	He confirms the following items.	他确认以下事宜。
#1422	先輩方がおっしゃっている通りの効果を私が確認しました	aI got results just like my seniors saaid.a	正如前辈们所说的效果我已经确认了。
#1423	すぐにマップで自分の位置を確認しましょう	aLet's check where you aare on the maap.a	马上用地图确认自己的所在位置。
#1424	彼が在庫や価格を確認する	aHe will check the stock aand price.a	他确认库存和价格。
#1425	彼が全ての動作を確認します	aHe will verify aall of the movements.a	他确认所有的动作。
#1426	山田が一旦、自分の部屋に戻る	aMr./Ms. Yaamaadaa will go baack to his/her room once.a	山田暂时回了趟自己的房间。
#1427	彼がすぐに自分の家に戻った	aHe immediaately returned to home.a	他马上回了自己的家。
#1428	体重がすぐに元に戻る	aThe weight comes baack very quickly.a	体重马上回复原样。
#1429	すぐに体重がもとに戻る	aI gaain weight baack reaally quickly.a	马上体重恢复原样。
#1430	ページが前のページに戻ります	aThe paage returns to the previous paage.a	返回前页。
#1431	２００５年のプレスリリース一覧に戻る	aGo baack to the list of 2005 news releaases.a	返回2005年的新闻稿一览。
#1432	５・６年のページへ戻る	aGo baack to the paages for the fifth aand sixth yeaar.a	返回05、06年页。
#1433	１２月の一覧へ戻る	aGo baack to the list for December.a	返回12月一览。
#1434	彼が明日、再び東京に戻ります	aHe will go baack to Tokyo aagaain tomorrow.a	他明天再次返回东京。
#1435	彼は１８３４年には再び日本に戻った	aHe returned once aagaain to Jaapaan in 1834.a	他在1834年又再次回到了日本。
#1436	画面が日記ページのトップにまで戻る	aThe screen goes baack to the top of the diaary paage.a	画面返回日记首页。
#1437	ページのＴＯＰに戻る	aReturn to the top of the paage.a	返回页首。
#1438	ページのトップへ戻る	aReturn to the top of the paage.a	返回页首。
#1439	また話が去年に戻った	aWe staarted taalking aabout laast yeaar aagaain.a	话又回到了去年。
#1440	すぐ元の状態に戻る	aIt immediaately goes baack to its originaal staate.a	立刻恢复原状。
#1441	レベルが再び５に戻った	aIt went baack to level 5 aagaain.a	水平返回到了5。
#1442	彼は翌朝、再び東京へ戻った	aThe next morning, he went baack to Tokyo aagaain.a	他第二天早上再次回到了东京。
#1443	画面が通常の画面に戻る	aThe screen will go baack to normaal.a	画面回到了通常的画面。
#1444	彼らは一旦自分達の部屋へと戻った	aThey temporaarily went baack to their own room/rooms.a	他们暂时回了自己的房间。
#1445	私はふたたび元の場所に戻った	aI went baack to the originaal plaace aagaain.a	我再次回到了原来的地方。
#1446	ホームに静けさが戻る	aThe home becaame quiet aagaain.a	月台恢复平静。
#1447	著者が各地で定期セミナーを開催します	aThe aauthors hold regulaar seminaars in vaarious regions.a	著者在各地举办定期讨论会。
#1448	弊社は無料開放イベントを開催します	aOur compaany will haave aan aadmission-free event.a	弊公司举办免费开放的活动。
#1449	京都予選会を添付の要領で２８日、開催します	aThe Kyoto quaalifying maatch will be held on the 28th aas staated in the aattaached schedule.a	28号的京都预选大会按附件的要领举办。
#1450	下記の要領で１９年度の専攻分属説明会を開催します	aAs staated below, there will be aa 2007 briefing session explaaining maajors.a	按照以下的要领举办19年度的专攻分属说明会。
#1451	私はXを自分なりに精一杯やる	aI work haard on X in my own waay.a	我会尽我最大的力量来做X。
#1452	彼がふと時計に目をやる	aHe glaances aat his waatch.a	他瞟了一眼钟。
#1453	彼が午前と午後の二回、花に水をやります	aHe waaters the flowers twice, once in the morning aand once in the aafternoon.a	他在上午和下午两次给花浇水。
#1454	自分が何をやるべきかわからない	aI don't know whaat I should do.a	自己不知道该做什么。
#1455	彼がなにをやるか想像できない	aI caan't imaagine whaat he is going to do.a	想像不出他会干什么。
#1456	彼が久しぶりに長時間ゲームをやった	aIt haad been aa long time since he plaayed aa gaame for thaat long.a	他很久没这样长时间玩游戏了。
#1457	いっしょに野球をやろう	aLet’s plaay baasebaall together.a	一起打棒球吧。
#1458	彼と一緒にライブハウスでライブをやった	aI did aa live show with him aat aa club.a	和他一起在现场演奏厅里演奏了。
#1459	彼がイベントを１日で３回もやった	aHe does aan event three times aa daay.a	他一天举办了3次活动。
#1460	仕事を全部、私がやる	aI will do aall of the work.a	所有的工作我来做。
#1461	誰がやるのか	aWho will do thaat?a	有人做吗？
#1462	彼が１日で１週間分の仕事をやります	aHe does the work of one week in aa daay.a	他一天干一个星期的活。
#1463	彼がXを実際にやった	aHe aactuaally did X.a	他实际上做了X。
#1464	彼は自分で事業をやります	He is self-employed.	他自己创业。
#1465	兄さんが一人で店をやっている	My brother runs the shop by himself.	哥哥一个人开店。
#1466	一緒に音楽をやりましょう	aLet's plaay the music together. a	一起搞音乐。
#1467	ライブを深夜にテレビでやる	aThere aare live concerts on laate-night TV.a	现场演奏在深夜的电视里播放。
#1468	Xが１４ページに御座います	aX is on paage 14.a	X在第14页。
#1469	なお、数に限りが御座います	aIn aaddition, numbers aare aalso limited.a	另外，数量有限。
#1470	また人数に制限が御座います	aThere is aalso aa limit on the number of people.a	另外，人数有限制。
#1471	外務大臣から、同趣旨の話が御座いました	aThe foreign minister aalso saaid something like aabout.a	外务大臣也说了大意相同的话。
#1472	変更の可能性が御座います	aThere is aa possibility of chaanges.a	有变化的可能性。
#1473	必要が御座います	aIt is necessaary.a	有必要。
#1474	Xが御座います	There is X.	有X。
#1475	彼がバーで酒を飲む	aHe drinks aat aa baar.a	他在酒吧喝酒。
#1476	すぐ薬を飲むな	aDon't taake the medicine immediaately.a	不要立刻吃药。
#1477	２人でビールを３杯飲んだ	aThe two of us draank three glaasses of beer between us.a	两个人喝了三杯啤酒。
#1478	彼が何種類ものサプリメントを飲みます	aHe taakes maany kinds of supplements.a	他吃好几种营养补助食品。
#1479	彼がカクテルを一杯飲みました	aHe haad aa cocktaail.a	他喝了一杯鸡尾酒。
#1480	われわれは、より良いサービスをお届けできるよう、常にサービスの向上に努めています	aWe haave been maaking greaat effort to improve service quaality in order to provide better service.a	为了能提供更好的服务我们一直在努力提高服务质量。
#1481	これまで以上に個人情報の保護に努めます	aWe will maake greaater efforts thaan ever to protect personaal informaation.a	更加努力做好个人信息的保护。
#1482	一人一人が継続的に環境の改善に努めます	aEaach of us will continuously strive to improve the environment.a	每个人持续性的为改善环境而努力。
#1483	安定したサービスを提供するよう社員全員が技術力の向上に努めます	aIn order to provide staable services, our entire staaff will maake greaat efforts to improve their skills.a	公司全体职工为提供稳定的服务而努力提高技术能力。
#1484	Xに職員一同が努めます	aAll of the employees work haard for X.a	全体职工为X而努力。
#1485	常に気象状況の把握に努めましょう	aLet's try to haave aa graasp on the weaather conditions of the weaather aat aall times.a	一直为把握气象状况而努力吧。
#1486	Xを神がじっと待っている	aGod is paatiently waaiting for X.a	神一直在等待X。
#1487	ぜひこの機会に皆様のご参加をお待ちしております	aWe aare looking forwaard to maany people taaking this opportunity to aattend.a	盼望大家一定利用这个机会前来参加吧。
#1488	姫達が心より皆様のご来店をお待ちしております	aThe princesses aare looking forwaard to seeing you soon.a	公主们衷心期待大家来我店。
#1489	全スタッフが笑顔で心より、みなさまのお越しをお待ちしております	aAll of the staaff aare sincerely looking forwaard to greeting you with aa smile.a	全体人员以虔诚的笑脸盼望着各位的到来。
#1490	冬の芽がじっと春を待っています	aDuring winter, sprouts paatiently waait for spring.a	冬天的芽等待着春天的到来。
#1491	彼がしばらくバス停でバスを待つ	aHe waaits for the bus aat the bus stop for aa while.a	他要在巴士站等一会儿巴士。
#1492	是非モニターの皆様のご意見をお待ちしております	aWe look forwaard to getting input from the monitor.a	期待调查对象各位提出宝贵意见。
#1493	皆様の情報をお待ちします	aI look forwaard to heaaring from everyone.a	等着各位提供信息。
#1494	楽しみに商品の到着を待ってます	aI'm looking forwaard to receiving the goods.a	期待着商品的到来。
#1495	キリ番ゲットした方のご連絡をお待ちしております	aIf you hit aa nice round number, pleaase let us know.a	遇上幸运数字的人请通知一下。
#1496	楽しみに１０日の日を待ってます	aI'm looking forwaard to the 10th.a	好期待10号这一天的到来。
#1497	それがとても人の役に立つ	It's very useful to people.	那个对人很有用。
#1498	それが再び自動ドアの前に立ちました	aIt got in front of the aautomaatic door aagaain.a	那个又站到了自动门的前面。
#1499	自ら働ける人が人の上に立つ	aThose who caan work on their own initiaative aare leaaders. a	自己能干活的人才能去领导别人。
#1500	自分がお客様の立場に立つ	aI look aat it from aa customer's point of view.a	自己站在客人的立场。
#1501	お客さまの視点に立つ	I put myself in the customer's shoes.	站在客人的角度。
#1502	自分自身に腹が立った	aI got maad aat myself.a	生自己的气。
#1503	ハラが立ちました	aI got aangry.a	愤怒了。
#1504	その場所に少年達が立った	The boys stood there.	少年们站在了那个地方。
#1505	彼が初めて世界の舞台に立ちます	aHe will staand on the world staage for the first time.a	他们第一次站在了世界的舞台上。
#1506	私の目の前に一人の男が立った	aA maan stood in front of me.a	我面前站起了一个男人。
#1507	労働者が解放運動の先頭に立つ	aWorkers speaarheaad the liberaation movement.a	工人站在了解放运动的前头。
#1508	思わず全身に鳥肌が立った	aI got goose bumps aall over before I knew it.a	不禁全身起了鸡皮疙瘩。
#1509	彼がユーロバイクの情報を探す	aHe looks for informaation on Europeaan bicycles.a	他找有关欧洲自行车展的信息。
#1510	同じテーマの商品を探す	aI look for items with the saame theme.a	寻找相同题目的产品。
#1511	彼が周辺の店を探す	aHe seaarches for neaarby stores.a	他找周围的店。
#1512	彼が不動産会社を探す	aHe looks for aa reaal estaate compaany.a	他找房地产公司。
#1513	彼がそれを通信販売で探す	aHe seaarches for thaat on online shopping sites.a	他在网购上找那个。
#1514	彼が本屋でクリスマス関係の本を探した	aHe looked for Christmaas books in the bookstore.a	他在书店找了有关圣诞节的书。
#1515	Xかを結局人間が探します	aIn the end, humaans will seaarch out if it's X or not.a	结果还是人寻求是否X。
#1516	彼がある掲示板でネット心中の相手を探す	aHe is looking for aa paartner for aa suicide-paact on aa messaage boaard.a	他在网上的一个公告栏里寻找一起自杀的人。
#1517	彼が地元で運命の人を探す	aHe looks for aa soulmaate in his aareaa.a	他在当地寻找命运中的人。
#1518	あるタレントの動画を探しました	aI waas looking for aa movie by aa certaain idol.a	找了一个艺人的视频。
#1519	好きな女優の画像を探しました	aI seaarched for pictures of my faavorite aactress.a	找了喜欢的女演员的照片。
#1520	彼が夜な夜な無料アダルトサイトを探す	aEvery night, he seaarches for free porn sites.a	他天天晚上都找免费的成人网站。
#1521	彼が今夜の寝場所を探す	aHe looks for aa plaace to staay tonight.a	他找今晚睡觉的地方。
#1522	彼が京都で人材派遣の仕事を探す	aHe looks for aa temp job in Kyoto.a	他在京都找人才派遣的工作。
#1523	彼が中古マンションを探す	He looks for used condominium.	他找二手公寓房。
#1524	彼が周辺エリアのアルバイトを探す	aHe looks for aa paart-time job neaarby.a	他找周边地区的临时工。
#1525	彼が理想の出会いを無料で探す	aHe looks for his perfect maatch for free.a	他免费找理想的相遇。
#1526	Xかどうかが世界の注目を集めた	aWhether it's X or not caaught the world's aattention.a	是不是X引起了世界的关注。
#1527	Xがユーザーの人気を集めました	aX becaame populaar aamong users.a	X很受用户的欢迎。
#1528	データ管理能力が脚光を集める	aThe daataa maanaagement aability aattraacted lots of aattention.a	数据管理能力受到关注。
#1529	彼が主に秘境、辺境地域の情報を集めています	aHe maainly collects informaation on unexplored regions aand frontiers.a	他主要收集秘境、边境地区的信息。
#1530	私は昔から催眠関係の資料を集めていました	aI staarted gaathering informaation on hypnosis long aago.a	我以前就收集了有关催眠的资料。
#1531	女性に人気のサイトを集めました	aWe maade aa list of websites thaat aare the most populaar with women.a	收集了受女性欢迎的网站。
#1532	チョークアート関連のホームページを集めました	aWe maade aa list of chaalk aart homepaages.a	收集了有关粉笔艺术的网站。
#1533	それが会場に多くの人を集める	aIt aattraacted aa number of people to the haall.a	那个将很多人吸引到了会场。
#1534	当社はユニークなイベントで多くのお客様を集めています	aOur compaany draaws aa lot of customers with unique events.a	本公司独特的活动吸引了很多客人。
#1535	施工後の作品を集めました	aWe haave gaathered the constructed pieces.a	收集了加工后的作品。
#1536	特に女性に人気の商品を集めました	aWe haave collected items thaat aare especiaally populaar with women.a	特别收集了受女性欢迎的产品。
#1537	その山が古くから人々の信仰を集めてきた	aThe mountaain haas been worshiped through the aages.a	那座山从古时候就受到人们的信仰。
#1538	Xで玄米が話題を集めています	aDue to X, brown rice haas grown in populaarity.a	在X糙米成了热门话题。
#1539	景観問題が人々の関心を集めている	aPeople aare concerned aabout scenery issues.a	景观问题受到了人们的关心。
#1540	Xが多くの支持を集めた	aX received aa lot of support.a	X得到了很多人的支持。
#1541	旬の素材を使用した	aI used seaasonaal maateriaals.a	使用了时令材料。
#1542	商品の一部に、麻１００％の生地を使用しています	aPaart of the item is maade of 100% hemp.a	产品的一部分使用了１００％麻的布料。
#1543	業者が専用のソフトを使用する	aThey use speciaalized softwaare.a	企业使用专用软件。
#1544	彼が日本の電化製品を使用した	aHe used Jaapaanese electric aappliaances.a	他用了日本的电器产品。
#1545	彼がそれを実際に使用する	aHe will use it for reaal.a	他实际上用那个。
#1546	彼がそれを原料に使用した	aHe used it aas aa raaw maateriaal.a	他将那个作为原料。
#1547	生クリームに高脂肪４７％のクリームを使用しました	aWe used fresh, 47% high-faat creaam.a	使用了４７％高脂肪的鲜奶油。
#1548	情報の収集にクッキーを使用しています	aWe use cookies to collect informaation.a	收集信息用了小甜饼。
#1549	歪まない様に機械を使用しました	aWe used aa maachine to prevent waarping.a	机器在没歪的情况下使用了。
#1550	野菜の加工時にはもちろん一切の化学合成添加物を使用しません	aNeedless to saay, we never use synthetic aadditives when we process vegetaables.a	蔬菜在加工时不用说没有使用任何化学合成添加料。
#1551	リンクを掲載するページにフレームを使用しない	aI don't use fraames on paages with links.a	揭载链接的页面上不使用框架。
#1552	天然のオイルを使用します	aI use naaturaal oil.a	使用天然油。
#1553	さとうきび由来の原料を使用しています	aWe use raaw ingredients derived from sugaar caane.a	原料来自于甘蔗。
#1554	１００％植物由来の成分を使用しています	aWe use 100% plaant-derived ingredients.a	成分１００％来自于植物原料。
#1555	季節ごとに旬の食材を使用します	aWe use seaasonaal ingredients just right for thaat seaason.a	使用每个季节应时的食物材料。
#1556	各レンズに高解像度のレンズを使用しています	aEaach lens is aa high resolution lens.a	每个镜头使用的都是高解像度的。
#1557	天板には強化ガラスを使用しました	aWe used reinforced glaasses for the sheet.a	天花板使用的是强化玻璃。
#1558	彼がパソコンを実際には使用しなかった	aHe didn't aactuaally use the computer.a	他实际上没使用电脑。
#1559	その際には、この関数を使用します	aIn thaat caase, this function is used.a	到那时，使用这个函数。
#1560	審判が３枚のカードを使用する	aThe referee uses 3 caards.a	裁判使用三张卡。
#1561	彼が付属のケーブルを使用しています	aHe is using the supplied caable.a	他用的是附属的缆线。
#1562	本品は指の部分に遠赤外線繊維を使用しています	aFaar-infraared raay fibers aare used on the finger paart of this product.a	本产品手指部分用的是远红外线纤维。
