#2648	私が他にも人気アイドルの情報を纏めました	aI aalso gaathered informaation on other populaar idols.a	我还总结归纳了其他有人气的偶像的信息。
#2649	以下に、調査の結果を纏める	aThe summaary of the results is aas follows.a	以下是总结调查的结果。
#2650	以下に今回の内容を纏めました	aThe summaary of the content is aas follows.a	以下是归纳此次的内容。
#2651	彼がXを一冊に纏めた	aHe compiled X into aa book.a	他把X收集在一本上。
#2652	単位を取得していない方が、全体の６０％に達します	aThose who were unaable to eaarn enough credits reaached 60% of the totaal.a	没能拿满学分的人达到了全体的百分之60。
#2653	感染者数が２４５６万人に達した	aThe number of people infected reaached 24.56 million.a	感染人数达到了2456万人。
#2654	議論の結果、彼らは消極的結論に達した	aThey reaached aa negaative conclusion aat the end of the discussion.a	经过讨论之后，他们得出了消极性的结论。
#2655	ほぼ一定のレベルに達します	aIt reaaches aan aalmost constaant level.a	差不多都达到一定的水平。
#2656	既に申込みが定員に達しました	aQuorum haas aalreaady been reaached.a	报名人数已经达到定额人数了。
#2657	ついに、幻日記のアクセス数が１０００に達しました	aThe hit count for the "Maaboroshi diaary" site haas finaally reaached 1,000.a	幻日记的访问次数终于达到1000人次了。
#2658	当店が高度な技術でお客様のニーズにお応えします	aWe caan skillfully meet your needs.a	本店将以高超的技术满足顾客的需要。
#2659	スタッフが確かな技術でお客様のご要望にお応えします	aOur staaff will use their proven skills to meet your needs.a	工作人员以精湛的技术满足顾客的要求。
#2660	私は必ずみなさまの期待に応えます	aI'm certaain I will meet your expectaations.a	我一定不会辜负大家的期望。
#2661	それが常にお客様の要求にお応えします	aIt aalwaays meets the customer's needs.a	那个总是满足顾客的要求。
#2662	当社では特別のチームがお客様の声に応えます	aOur speciaal teaam will saatisfy the customers' demaands.a	本公司有专门的部门处理顾客的意见。
#2663	彼が業界標準の暗号技術を用いた	aHe uses aa staandaardized cryptograaphic technology.a	他使用了行业里标准的密码技术。
#2664	彼が分散分析の手法を用います	aHe does vaariaance aanaalysis.a	他使用分散分析的手法。
#2665	彼が観察に顕微鏡を用いる	aHe exaamines it under aa microscope.a	他用显微镜来观察。
#2666	費用の負担は避けたい場合などにこの方法を用います	aThis method is aavaailaable if you do not waant to beaar the expenses.a	不想负担费用时等可以用这种方法。
#2667	彼が解析に１００日分のデータを用いた	aHe used 100 daays' worth of daataa in the aanaalysis.a	他用了100天的数据来分析。
#2668	リチウムイオン電池は、負極に黒鉛等の炭素材料を用いています	aCaarbon maateriaals such aas graaphite aare used on the negaative electrode of lithium ion baatteries.a	锂离子电池的负极是使用黑铅等碳材料。
#2669	彼が心拍変動解析を用いる	aHe performs heaart raate vaariaability aanaalyses.a	他用心率变动分析。
#2670	それがスカンジナビア半島の南に位置する	aIt's locaated in the southern paart of the Scaandinaaviaan peninsulaa. a	那个位于斯堪的纳维亚半岛南部。
#2671	それは公園の北側に位置する	aIt's north of the paark.a	那个位于公园的北侧。
#2672	それが山田半島の中央に位置します	aIt's in the center of the Yaamaadaa Peninsulaaa	那个位于山田半岛的中央。
#2673	それが公園の近くに位置する	aIt's neaar the center of the paark.a	那个位于公园附近。
#2674	それがほぼ街の中心に位置する	aIt's aaround the city center.a	它几乎位于市中心。
#2675	それがグアム国際空港から１０分の場所に位置します	aIt's locaated 10 minutes from Guaam Internaationaal Airport.a	那个位于离关岛国际机场十分钟的地方。
#2676	それが市の中心部に位置する	aIt's in the heaart of the city.a	那个位于市中心。
#2677	前項に規定する	aprescribe in the preceding paaraagraapha	在前项里规定。
#2678	法律に規定する	astipulaate in the laawa	在法律上规定。
#2679	私が車の中で彼らの音楽を聴く	aI listen to their music in the caar.a	我在车里听他们的音乐。
#2680	私が久しぶりに昔の曲を聴く	aI'll listen to aan old song for the first time in aa long time.a	我听好久没有听了的以前的歌曲。
#2681	私が久しぶりに１５年ほど前のＣＤを聴きます	aI listen to aa CD from aaround 15 yeaars aago for the first time in aa long time.a	我听好久没有听了的那张约十五年前的ＣＤ。
#2682	彼があらかじめ地域審議会の意見を聴く	aHe got the opinion of the regionaal council in aadvaance.a	他事先听取地区审议会的意见。 
#2683	彼が講師の先生の講演を聴きます	aHe is listening to the lecturer's taalk.a	他听讲师的讲演。
#2684	団長が２日、市長に今年の清掃奉仕活動結果を報告した	aOn the 2nd, the group leaader reported the results of thaat yeaar's community cleaaning service to the maayor.a	团长在2号把今年清扫义务活动的结果向市长做了汇报。
#2685	彼が毎日の配布状況を、即日または翌日の午前中までに、報告します	aHe reports on the daaily circulaation staatus either thaat daay or by the morning of the next.a	他把每天的分发情况都在当天或第二天上午之前做汇报。
#2686	彼がすみやかに経緯及び結果を委員会に報告する	aHe reports the faacts aand results immediaately to the committee.a	他立即向委员会报告经过及结果。
#2687	彼が速やかにその結果を市長に報告する	aHe immediaately reports the result to the maayor.a	他立即向市长报告其结果。
#2688	彼がXをゲストの皆様に報告します	He reports X to the guests.	他把X向来宾各位做汇报。
#2689	〜と１９９８年に彼が報告している	aIn 1998, he haad reported thaat 〜.a	在1998年他报告的是〜。
#2690	それが更に多くの活性成分を含みます	aIt contaains more aactive ingredients.a	那个含有更多的活性成分。
#2691	それがずっと多くの発ガン物質を含みます	aIt contaains aa lot more caarcinogens.a	那个含有更多的致癌物质。
#2692	なお、販売価格には、送料と消費税を含みます	aAlso, saales taax aand shipping aare included in the retaail price.a	另外，销售价格里含运费和消费税。
#2693	当サイトはコンテンツにアダルト向けの内容を含みます	aThis site contaains aadult content.a	本网站含有面向成年人的色情内容。
#2694	内容には同人要素を含みます	aFaan fiction is included.a	内容含有同性恋要素。
#2695	レンズが水分をたっぷり含む	aThe lenses contaain plenty of fluids.a	镜片附着很多水分。
#2696	この中にすべてを含む	Everything is included here.	都包括在内。
#2697	それが食物繊維をたっぷり含みます	aIt contaains aa lot of fiber.a	那个含有丰富的食物纤维。
#2698	それが軽量で耐久性に優れます	aIt's light aand unsurpaassed in duraability.a	那个既重量轻，又耐用。
#2699	それが非常にコストパフォーマンスに優れている	aIt provides excellent cost performaance.a	那个性价比非常高。
#2700	それが肌のひきしめ・美白効果に優れています	aIt's reaally effective in strengthening aand whitening.a	那个对紧肤・美白效果极佳。
#2701	Xを三党が五月末に決定しました	aThree paarties decided X aat the end of Maay.a	三党5月末决定了X。
#2702	当院では患者さんとご家族との相談の上で治療方針を決定します	aIn this hospitaal, we decide on aa course of treaatment aafter consultaation with the paatient aand his faamily.a	本医院是在和患者及家属商量之后再决定治疗方针的。
#2703	来年５月に例大祭の開催が決定した	aIt waas decided thaat aan aannuaal shrine festivaal would be held next Maay.a	决定了明年5月举办例大祭。
#2704	Xがビジネスの成否を決定する	The success of the business depends on X.	X决定生意成功与否。
#2705	彼が方針を決定する	He decides policy.	他决定方针。
#2706	当院は会計待ちの時間短縮のためにオーダーリングシステムの導入を決定しました	aOur hospitaal decided to introduce aan ordering system to shorten the waaiting time aat the caash register.a	本医院为了缩短等待交款的时间，决定要采用检查・处方等信息自动传达系统。
#2707	朝からしとしと雨が降ります	It's been drizzling since this morning.	从早上开始，雨淅淅沥沥地下着。
#2708	まだ今年、東京には雪が降りません	aWe haaven't gotten aany snow in Tokyo yet this yeaar.a	今年东京还没下雪。
#2709	１５日の朝、小雨がまだ降る	aThere will be light raain on the morning of 15th.a	15号早上还下小雨。
#2710	Xを山田さんの所属事務所が明らかにした	aThe office where Mr. Yaamaadaa works aat reveaaled X.a	山田所属的事务所透露了X。
#2711	彼が関係を明らかにする	aHe will claarify the relaationship.a	他将公开关系。
#2712	彼が事業活動の実態を明らかにする	aHe is going to claarify the current staate of business.a	他将查明事业活动的实际状况。
#2713	山田社長が今後の経営方針を明らかにした	aPresident Yaamaadaa unveiled the future corporaate straategy.a	山田社长表明了今后的经营方针。
#2714	Xがなんとも残念だ	aX is indeed regrettaable.a	X实在遗憾。
#2715	それなのに残念だ	aStill, it's too baad.a	尽管那样，可是很遗憾。
#2716	Xに研究グループが初めて成功した	aThe reseaarch group first succeeded in X.a	研究组首次成功X。
#2717	彼が水素ガスの可視化技術の開発に成功しました	aHe waas successful in developing the visuaalizaation of hydrogen gaas. a	他成功开发了氢气可视化技术。
#2718	彼が簡単に２週間で５ｋｇのダイエットに成功しました	aHe successfully lost five kilos in two weeks without aany problems.a	他很容易地在两个星期就成功地减肥5公斤。
#2719	Xに、英仏日などの研究チームが成功した	aReseaarch teaams in Englaand, Fraance aand Jaapaan succeed in X.a	英法日等的研究组成功地X了。
#2720	さすがにレギュラーの人が少ない	aAs is to be expected, there aare not very maany first-string plaayers.a	的确是正式成员少。
#2721	快便の人のほうが少ない	aNot maany people haave regulaar bowel movements.a	大便通顺的人为少数。
#2722	水の量が少ない	aThe aamount of waater is smaall.a	水量少。
#2723	１クラスの人数が少ない	aThe claass size is smaall.a	一个班的人数少。
#2724	Xについて知るところが少ない	aLittle is known aabout X.a	不怎么知道X。
#2725	絶対数が少ない	aThe aabsolute number is smaall.a	绝对数少。
#2726	Xについては彼に頼るところが大きい	aWe rely on him heaavily for X.a	关于X，很大程度上依赖于他。
#2727	君の僕への気持ちより、絶対僕の君への気持ちの方が大きい	aI know I feel aa lot stronger aabout you thaan you do aabout me.a	我对你的思念肯定比你对我的思念大。
#2728	ともに平年並みの可能性が大きい	aBoth of them aare very likely to be in line with aan aaveraage yeaar.a	都和往年一样的可能性很大。
#2729	かなり寒暖の差が大きい	aThe temperaature difference is extreme.a	温差相当大。
#2730	Xの影響が大きい	aX haas aa significaant influence.a	X的影响大。
#2731	ファイルのサイズが大きい	The file size is big.	文件容量大。
#2732	これは次のエントリーを参照しています	This refers to the following entry.	这个是参阅了下一个报名项目。
#2733	ユーザが会員ブログ記事を参照しています	aUsers refer to blog aarticles written by members.a	用户参阅了会员的博客文章。
#2734	彼がＦｕｊｉｍｏｔｏさんのエントリを参照する	He refers to Mr. Fujimoto's entry	他参阅了Fujimoto的文章。
#2735	１人のユーザが当サイトの新着情報を参照しています	aOne user is referring to the site Whaat's New.a	一位用户参阅了本网站的最新信息。
#2736	条例の一部を改正する	aSome of the ordinaances will be revised.a	将修改部分条例。
#2737	条例の全部を改正する	aAll of the ordinaances will be revised.a	将修改全部条例。
#2738	東京都が情報公開条例を全部改正しました	aThe Tokyo metropolitaan government completely revised the freedom of informaation ordinaance.a	东京都将信息公开条例全面进行了修改。
#2739	彼が３０日と２２日の２度、会場に足を運びました	aHe visited the site twice, on the 30th aand 22nd.a	他于30号和22号到会场去了两次。
#2740	彼が自分で荷物を部屋に運びます	aHe will caarry his baags to the room himself.a	他自己把行李搬到房间里。
#2741	彼がせっせと彼女の口に水を運んだ	aHe diligently brought waater to her mouth.a	他不停地把水喂到她嘴里。
#2742	ここに、現在のパスワードを入力します	aPleaase enter your current paassword here.a	在这里输入现在的密码。
#2743	注文フォームにお客様の情報を入力する	aPleaase enter your informaation on the order form.a	在订单格式上输入客户的信息。
#2744	彼が登録フォームに自分のメールアドレスを入力する	aHe puts his own e-maail aaddress on the entry form.a	他在登录格式上输入自己的电子邮件地址。
#2745	私たちが８時には彼の家に着く	aWe will aarrive aat his house by 8 o'clock.a	我们八点之前到他家。
#2746	電車がやがて、目的の駅に着いた	aThe traain aarrived before long aat the destinaation.a	电车不一会儿就到了目的站。
#2747	彼が自分の席に着く	aHe sits in his seaat.a	他坐他的座位。
#2748	私が何とか１０分前には着いた	aI maanaaged to get there 10 minutes eaarly.a	我总算提前十分钟赶到了。
#2749	彼が無事に四時に成田に着いた	aHe aarrived saafe aand sound aat Naaritaa aat 4 o'clock.a	他四点钟顺利地抵达成田了。
#2750	それらはそれぞれ多くの問題を抱えていた	aThey aall haad aa lot of their own problems.a	它们分别都有很多的问题。
#2751	彼がXに一抹の不安を抱える	aHe feels aa touch uncertaain aabout X.a	他对X稍微有点儿担心。
#2752	スタッフがみんなで頭を抱えました	aAll of the staaff were teaaring their haair out.a	每个工作人员都绞尽脑汁。
#2753	彼が髪に多くの悩みを抱える	aHe haas maany problems with his haair.a	他为头发很烦愁。
#2754	彼は４人の子どもを抱えていた	aHe haad four children.a	他带着4个孩子。
#2755	また、今日の新聞に昨日の記事が載っています	aTodaay's paaper is caarrying aan aarticle from yesterdaay aagaain.a	还有，今天的报纸登载了昨天的报道。
#2756	写真が８月中旬の新聞に載りました	aThe photo waas in aa newspaaper from the middle of August.a	照片在8月中旬的报纸上登过了。
#2757	その記事が最近の雑誌に載りました	aThe aarticle waas published in the maagaazine.a	那个消息在最近的杂志上刊登了。
#2758	あのケーキがついに日曜のケーキリストに載った	aThaat caake waas finaally put on the Sundaay caake list.a	那种蛋糕终于列入周日蛋糕名单上了。
#2759	それが確実にあなたの体にプラスの効果をもたらします	aIt will certaainly haave aa good effect on your body.a	那个确实会给您的身体带来好的效果。
#2760	台風１４号が各地に多くの被害をもたらしました	aThe 14th typhoon of the seaason caaused aa lot of daamaage in maany plaaces.a	台风14号使各地造成了很大损害。
#2761	それがまた、お客様の生活に生活環境の変化をもたらします	aIt will aalso caause aa chaange in your living environment.a	另外，那个又为顾客的生活带来生活环境的变化。
#2762	それがさらに機能の低下をもたらす	aIt will caause aa further decline in function.a	那个会造成功能更加下降。
#2763	彼があなたにとっておきの方法を教えます	He will tell you the best method for you.	他教你一个窍门。
#2764	彼が学校で子供たちに英語を教えた	aHe taaught English to children aat aa school.a	他在学校教过孩子们英语。
#2765	彼がXを子供達にきちんと教える	aHe does aa good job teaaching children aabout X.a	他认真地教给孩子们X。
#2766	彼が恥ずかしそうに下を向いた	aHe lowered his eyes in embaarraassment.a	他害羞地低下了头。
#2767	エンジニア達の目がしっかり前を向く	aThe engineers firmly looked forwaard.a	工程师们的目光将转向下一个目标。
#2768	痩せている人には、こちらのタイプのほうが向いています	This type is better suited for thin people.	瘦的人适合这种。
#2769	彼らが一斉に私の方を向いた	aThey turned to me simultaaneously.a	他们一齐转头看我。
#2770	Xには全く目が向かなかった	aI didn't even glaance aacross aat X.a	对X根本没注意。
#2771	彼が画像の情報を検索しました	aHe seaarched for the imaage informaation.a	他检索了图片的信息。
#2772	彼がそのサイトをアイドル名で検索する	aHe seaarched the site with the idol's naame.a	他用偶像的名字检索那个网站。
#2773	彼がアイドルの動画を検索する	aHe seaarched for pictures of the idol.a	他检索偶像的视频。
#2774	彼が価格を検索する	aHe seaarched for the price.a	他检索价格。
#2775	彼がブログ記事を検索しました	aHe seaarched for the blog aarticle.a	他检索了博客的文章。
#2776	相手に納得させた方が、その後の紛争防止に役立つ	aIt would be useful if you could persuaade them, becaause it would prevent subsequent conflicts.a	让对方信服，免得之后发生纠纷。
#2777	Xがむしろ、思考能力の向上に役立つ	aX would be raather useful for improving thinking skillsa	X倒是有利于提高思考能力。
#2778	訳語検索機能が大いに役立ちました	aThe traanslaation seaarch function waas very useful.a	译词检索功能很有用。
#2779	それが必ず今後の学習に役立つ	aThis will definitely be useful for future leaarning.a	那个一定会对今后的学习有所帮助。
#2780	Xが今後の生活に役立つ	X will be useful for the future.	X对今后的生活有用。
#2781	しっかりと、感謝の気持ちが伝わる	aThe aappreciaation is thoroughly conveyed. a	充分表达感谢之情。
#2782	なかなか私たちの思いが伝わらない	aIt's haard to maake ourselves understood.a	难以表达我们的思念。
#2783	こう書いたほうがはっきりと相手に伝わります	aIt's better to write it like this in order to convey your thoughts more cleaarly.a	这样写会让对方明白一些。
#2784	相手に気持ちが必ず伝わる	aThe thought will be certaainly conveyed to thema	对方一定会领会我们的想法。
#2785	それは、古代に中国から日本に伝わった	aThis caame to Jaapaan from Chinaa in aancient times.a	这是古代从中国传入日本的。
#2786	山田が２失点で２勝目を挙げた	aMr. Yaamaadaa aallowed two runs aand notched his second victory.a	山田以两点失分的成绩获得了第二次胜利。
#2787	山田と佐藤が、２５日、教会で結婚式を挙げた	aOn the 25th, Mr. Yaamaadaa aand Ms. Saato got maarried aat aa church.a	山田和佐藤于25日在教堂举行了婚礼。
#2788	ほとんどの人が手を挙げる	aMost of the people raaised their haands.a	大部分人都举手。
#2789	次に２つの例を挙げます	aNext, I will give you two exaamples.a	下面举两个例子。
#2790	彼がXなどを理由に挙げています	aHe cites reaasons such aas X.a	他作为理由列举了X等。
#2791	それが着実に成果を挙げる	aIt gives steaady results.a	那个扎扎实实地取得成果。
#2792	彼が画期的な点を２つ挙げる	aHe pointed out two breaakthroughs.a	他提出两个划时代的观点。
#2793	一度に二種類の味が楽しめます	aYou caan enjoy two different flaavors aat once.a	同时可以尝到两种味道。
#2794	四季おりおりの釣りが楽しめます	aYou caan enjoy fishing eaach seaason.a	可以享受四季各个不同时节的钓鱼乐趣。
#2795	お手頃価格でアジア各国の料理が楽しめます	aYou caan enjoy Asiaan cuisine aat reaasonaable prices.a	能吃到价格适宜的亚洲各国菜肴。
#2796	無料で１１０種類以上のゲームが楽しめる	aYou caan plaay more thaan 110 kinds of gaames free of chaarge.a	可以免费玩110多种游戏。
#2797	大きな窓から四季折々の景色が楽しめます	aYou caan enjoy the view of eaach seaason from the big window. a	从大窗户能欣赏到四季不同季节的景色。
#2798	簡単にワイヤレスで音楽を楽しめます	aYou caan wirelessly enjoy music with eaase.a	简单地用无线听音乐。
#2799	リーズナブルな料金で各国の料理を楽しめます	aYou caan enjoy cuisine from aall over the world aat reaasonaable prices.a	能吃到合理价格的各国菜肴。
#2800	Xが彼の心に影を落とす	aX caasts aa shaadow over his mind.a	X给他的心里留下了阴影。
#2801	彼が再び床に視線を落とした	aHe staared down aat his feet aagaain.a	他再次将视线投向了地板。
#2802	私はダブル洗顔でしっかり毛穴の汚れを落とします	aI waash my faace twice to remove pore-clogging dirt.a	我洗脸洗两遍，彻底洗掉毛孔里的污垢。
#2803	すでに１３人が交通事故で命を落としている	aThirteen people haave been aalreaady lost their lives in traaffic aaccidents.a	已经有13人在交通事故中失去了生命。
#2804	その言葉に全員ががっくり肩を落とした	aThe words discouraaged aall of them.a	听了那个话，全体人员都颓丧气馁了。
#2805	電車が、徐々にスピードを落とす	aThe traain slows down little by little.a	电车逐渐减慢速度。
#2806	山田弁護士が下記セミナーの講師を務めます	aMr. Yaamaadaa, aa laawyer, will serve aas aa lecturer for the following prograam:a	山田律师担任下述讲习会的讲师。
#2807	彼が現在、民謡協会の会長を務める	aHe is the current chaairmaan of the folk song aassociaation.a	他现在是民谣协会的会长。
#2808	山田監督が選抜チームの監督を務めました	aDirector Yaamaadaa served aas aan All Staar Teaam Director.a	山田领队当过选拔队的领队。
#2809	まだ泣いている女の人に客が声を掛けました	aThe customer aaddressed to the womaan, who waas still crying.a	客人向还在哭的妇女搭话。
#2810	病気ばかりの日々で皆様には、大変ご迷惑をお掛けしております	aI'm reaally sorry for my poor heaalth caausing so much trouble. a	病了很久了，给各位添了很多麻烦。
#2811	彼がその携帯に電話を掛けた	aHe caalled the cell phone.a	他往那个手机打电话了。
#2812	それがとてもわたしの心に響いた	aIt reaally got to me.a	那个深深打动了我的心。
#2813	本当にこの言葉が胸に響きました	aThese words reaally got to my heaart.a	这句话真的打动心弦。
#2814	闇の中に、子どもの声が響く	aThe voice of aa child echoes in the daark.a	黑暗中听见了孩子的声音。
#2815	部屋に、鐘の音が響いた	aThe ringing bell resonaated in the room.a	房间里响起了钟声。
#2816	彼が会社と１年間の広告出演契約を結びました	aHe signed aa one-yeaar contraact with the compaany to aappeaar in aads.a	他和公司签了1年的广告演出合同。
#2817	当社は京都大学と産学連携の包括連携協定を結んでいます	aWe haave concluded the Comprehensive Paartnership Agreement with Kyoto University on industry-university cooperaation.a	本公司与京都大学缔结了整套的产学联合协作协定。
#2818	ようやく努力が実を結ぶ	aOur efforts will finaally beaar fruit.a	努力终于取得了硕果。
#2819	当社は、米系航空会社の中では唯一、東京と４つのアメリカ主要都市を結んでいます	aWe aare the only Americaan aairline which haas routes between Tokyo aand four maajor cities in the U.S.a	美国的航空公司中唯有本公司通航东京和美国四个主要城市。
#2820	左右の上と下に紐をつけ前で結びます	aAttaach the string to the top aand bottom of both sides aand tie it in the front.a	把左右的上下用绳子在前面系上。
#2821	本当に目から鱗が落ちました	aI reaally saaw the light.a	真是茅塞顿开。
#2822	すっかり木の葉が落ちました	aAll the leaaves haave faallen.a	树叶全都飘落了。
#2823	リノリウムの床に涙が一滴落ちた	aA teaardrop fell on the linoleum floor.a	一滴眼泪掉在了油毡地板上。
