#4028	彼がバス乗り場を駅前の店の人に尋ねる	aHe will aask the clerk working aat the shop in front of the staation where the bus stop is.a	他向车站前店里的人打听巴士乘车站。
#4029	彼が４回も人に道を尋ねた	aHe aasked for directions four times.a	他都向人打听过4次道了。
#4030	Xかとみんなが私に尋ねる	aEveryone aasks me if it's X.a	大家询问我是否X。
#4031	彼が気持ちを、自分のことばで表現しました	He expressed his feelings in his own words.	他用自己的话表达了心情。
#4032	彼が追放されたという感情を、自分の言葉で表現した	aHe expressed his feelings aat being baanished in his own words.a	他用自己的话诉说了被赶出来了的心情。
#4033	それがXに焦点を絞ります	It focuses on X.	那个把焦点集中到X。
#4034	政府はXに的を絞るべきだ	The government should focus on X.	政府应该把目标锁定到X。
#4035	彼がなんとかすべての敵を倒した	aHe maanaaged to defeaat aall of his enemies.a	他好不容易才打倒所有的敌对。
#4036	彼がはじめてステージ２のボスを倒しました	aHe cleaared the staage 2 boss for the first time.a	他第一次打败了二级头目。
#4037	彼が主に通信／制御系システムの開発を手掛ける	aHe is maainly engaaged in the development of the communicaation/control system.a	他主要负责通讯／控制系统方面的开发。
#4038	彼がデザインを手掛ける	aHe will be in chaarge of the design.a	他从事设计工作。
#4039	コストパフォーマンスの高さにはいつも舌を巻く	aI'm aalwaays aadmired for the high cost-effectiveness raatio.a	对性能价格比如此之高总是赞叹不已。
#4040	風がゆっくり渦を巻く	The wind is swirling slowly.	风缓慢地卷起了漩涡。
#4041	当社が資料発送業務を外部の業者に委託します	aWe will outsource the maateriaal delivery service.a	本公司把资料发送业务委托给外部的企业。
#4042	弊社は本サービスの業務を外部の専門会社に委託します	aWe will outsource this service to aan outside speciaalty compaany.a	本公司把该项服务业务委托给外部的专业公司。
#4043	彼がそれに自動操縦装置を取り付ける	aHe will instaall aautopilot on it.a	他把自动操作装置安装到那里。
#4044	本体側には付属のカバーを取り付けます	aAttaach the aaccompaanying cover on it.a	机身侧安装上附件套盖。
#4045	コミュニケーションがもっと脳を鍛える	aCommunicaation would further improve braain function.a	交流更能锻炼头脑。
#4046	一緒にジムで体を鍛えた	aWe worked out aat aa gym together.a	一起在健身房锻炼身体。
#4047	派遣業界は、まだまだ多くの可能性を秘めています	aThe temp industry still haas aa lot of potentiaal.a	派遣业界还蕴藏着很多可能性。
#4048	彼が大きな力を秘めている	aHe haas greaat potentiaal.a	他蕴藏着巨大的力量。
#4049	ひとりの女性が子どもを２人産む	aOne womaan gives birth to two children.a	一个女性生两个孩子。
#4050	それが泥の中に球形の卵を５０個ほど産む	aIt laays aabout 50 round eggs in the mud.a	那个在泥中产下了50来个圆形卵。
#4051	彼が今すぐには会社を辞めない	aHe won't quit his job in the immediaate future.a	他不会马上辞掉工作。
#4052	彼がすぐに仕事を辞めた	He soon quit his job. 	他当即辞掉了工作。
#4053	彼が心から神に感謝の祈りを捧げます	aHe offers aa sincere praayer of thaanks to God.a	他向神致以发自心底的感谢。
#4054	私があなたに私のすべてを捧げます	aI will give you everything I haave. a	我为您奉献我的一切。
#4055	ユーザーがオリジナルサイズのファイルをダウンロードできます	aUsers caan downloaad the originaal-size file. a	用户可以下载原本大小的文件。
#4056	それがまた、作者のホームページからもダウンロードできます	aIt aalso caan be downloaaded from the aauthor's homepaage.a	另外，那个还可以从作者的网页下载。
#4057	ＭＴ形式のデータファイルがダウンロードできます	aMT daataa files caan be downloaaded.a	可以下载ＭＴ形式的数据文件。
#4058	自動的にパソコンの電源が切れます	aThe computer will aautomaaticaally turn off.a	电脑的电源自动关闭。
#4059	今月でカードの期限が切れる	aThe caard will expire aat the end of this month. a	到这个月卡就到期了。
#4060	彼がテレビの生番組に出演しました	aHe aappeaared on live TV.a	他上了电视的实况演播。
#4061	彼が現在すでに５本の映画に出演している	aHe haas aalreaady aappeaared in five movies. a	他目前已经演了5部电影了。
#4062	彼がなんとか毎日の仕事をこなした	aHe maanaaged to perform his daaily taasks.a	他勉强干好每一天的工作。
#4063	彼がなんとか日々の業務をこなします	aHe maanaages to do his daay-to-daay taasks.a	他勉强做好日常的业务。
#4064	それが制動システムに最先端の技術を取り入れた	aIt introduced the laatest technology in the braaking system. a	那个对制动系统导入了最先进的技术。
#4065	多くの学校が自然体験活動をカリキュラムの中に取り入れています	aMaany schools incorporaate experiencing naature in the curriculum. a	很多学校把体验自然活动编入教学计划之中。
#4066	彼が電子部品関係の会社に勤めています	aHe works for aan electronics compaany.a	他在电子零件相关的公司上班。
#4067	彼は現在、京都大学等の非常勤講師を勤めている	aHe currently works aas aa paart-time lecturer aat Kyoto University aand other schools.a	他现在担任京都大学等的兼课老师。
#4068	彼が通算得点で山田選手に逆転を許す	aHe haanded Mr. Yaamaadaa aa come-from-behind victory in the totaal score.a	他在总计得分上让山田选手反败为胜。
#4069	彼がXを自分に許す	aHe aallows himself X.a	他对自己允许X。
#4070	それが全く他社の追随を許しません	aIt's unrivaaled by aany other compaanies.a	那个是其它公司所不能企及的。
#4071	当店は多数の商品を揃えております	aWe caarry aa lot of products.a	本店备齐了大量的商品。
#4072	〜とみんなが口を揃える	aMaany people saay 〜.a	大家异口同声地说〜。
#4073	下記のとおり補助金の交付を申請します	aI will aapply for the graant aas follows:a	按下列方法申请发给补助金。
#4074	申請者が自ら市長に暗証番号の登録を申請する	aThe aapplicaants themselves aapply for aa PIN registraation from the maayor.a	申请者自己向市长申请密码登记。
#4075	重厚感のあるインテリアが大人の雰囲気を演出する	aThe staately interior creaates aa maature impression.a	具有庄重感的室内装饰伴有成年人的氛围。
#4076	やさしい光が癒しの空間を演出します	aThe gentle light creaates aa comforting environment.a	柔和的光线伴有疗愈的空间效果。
#4077	こうして街から人の姿が消えました	aThus, people haave left the town.a	就这样人影从街上消失了。
#4078	私の意識がそのまま闇の中に消えた	aI faaded out.a	我的意识就那样在黑暗中消失了。
#4079	完全に全てのデータが消えた	aAll the daataa is gone.a	所有的数据完全都消失了。
#4080	彼が１００段の階段を上った	aHe climbed aa flight of 100 steps.a	他爬了100阶的台阶。
#4081	Xがあまり話題に上りません	aX doesn't come up in conversaation often.a	X不大成为话题。
#4082	ふと、店主の言葉が俺の頭をよぎる	The shopkeeper's words suddenly run in my mind.	忽然店里老板的话掠过我的脑海。
#4083	脳裏にふと不安がよぎります	aAn aanxious thought flaashed through my mind.a	脑里突然掠过一丝不安。
#4084	彼がXなどを考慮する	aHe considers X aand others.a	他考虑X等。
#4085	彼が冬と夏の状況を考慮する	aHe considers whaat it is like in winter aand in summer.a	他考虑冬天和夏天的状况。
#4086	彼が運動使用時の安全性を考慮する	aHe considers the saafety of when it's used for sports aand exercise.a	他考虑在运动使用时的安全性。
#4087	交付申請書には以下の書類を添付する	aThe following documents should be included with the graant aapplicaation forms.a	交付申请书里附上以下的资料。
#4088	彼が申請書に６ヶ月以内の写真を添付します	aHe will include aa photo taaken within six months with the aapplicaation form.a	他要在申请书上贴上6个月以内的照片。
#4089	彼が急に睡魔に襲われた	He suddenly felt sleepy.	他突然犯困。
#4090	彼が突如二人組の男に襲われる	aHe is suddenly aattaacked by two men.a	他突然遭到两个男人同伙的袭击。
#4091	デジタル用語集には、情報が満載だ	aThe digitaal glossaary is filled with informaation.a	数码用语集里信息应有尽有。
#4092	観戦に必要なデータが満載だ	aIt's filled with the daataa needed to waatch.a	登满观看比赛需要的数据。
#4093	Xについつい手が伸びた	aI've aalwaays end up going for X.a	不知不觉手伸向了X。
#4094	売り上げがこの一年間で１５％近く伸びた	aSaales grew by aalmost 15% over the paast yeaar.a	销售额在这一年里增长了将近15%。
#4095	彼が今春に実施設計と既存施設の解体工事に着手する	aThis spring, he will draaw up execution designs aand staart demolishing the existing faacilities.a	他将于今春着手实施设计以及现有设施的解体施工。
#4096	われわれは二十二日までに、山田医科大と共同でがん登録支援システムの開発に着手した	aBy the 20th, we haad staarted developing aa caancer registry support system with the Yaamaadaa Medicaal University.a	二十二日之前我们着手与山田医科大学共同开发癌症登录支援体系。
#4097	大都市圏の相場がようやく落ち着きを取り戻しました	aThe maarkets in the metropolitaan aareaa finaally settled down.a	大都市圈的行情好不容易恢复了平稳。
#4098	ようやく彼女が意識を取り戻した	aShe eventuaally regaained consciousness.a	她的意识终于恢复过来了。
#4099	Xが私には多かった	aI haad aa lot of X.a	X对我很多。
#4100	あまりに人が多すぎます	aThere aare too maany people.a	人简直太多了。
#4101	彼がちゃんとトイレのドアを閉めます	aHe maade sure to close the baathroom door.a	他关严厕所的门。
#4102	彼が静かに部屋の扉を閉めた	He quietly closed the door of the room.	他悄悄地把房间的门关上。
#4103	Xがなんか嫌だ	aX is aa paain.a	X总讨人厌。
#4104	Xで介護保険サービスの利用が可能になります	aYou will be aable to use the nursing caare insuraance service with X.a	在X，可以利用护理保险服务了。
#4105	Xで本人確認情報の検索が可能になる	aX enaables the seaarch of personaal identificaation informaation.a	在X，可以搜索确认本人信息。
#4106	彼は声がでかそうだ	He looks like he's loud.	他声音好像很大。
#4107	まさに私がそうだ	aI'm exaactly like thaat. a	我正是那样的。
#4108	彼が激安通販の価格を評価します	aHe aappraaises laarge discount maail-order prices.a	他评价特低价函售的价格。
#4109	要求水準を満たしているか否かを外部機関が評価する	aExternaal institutions evaaluaate whether or not the required staandaards haave been met.a	外部机关评价是否达到了要求水准。
#4110	一時のタイムスリップ感覚が味わえる	aYou caan haave aa taaste of slipping through time.a	能够玩味一时穿越时空的感觉。
#4111	手軽にアウトドア気分を味わえる	aYou caan eaasily haave aa taaste of the outdoors.a	可以轻松享受户外感觉。
#4112	改めて教育のあり方が問われます	aOnce aagaain, we haave to consider whaat educaation should be.a	再次突出了教育方面的问题。
#4113	乗組員が大麻取締法違反の罪に問われた	aMembers of the crew were aaccused of violaating the Caannaabis Control Laaw.a	乘务员被控违反大麻取缔法罪。
#4114	Xが私たちに問われている	aWe haave been aasked aabout X.a	X就在于我们。
#4115	それらを共に器に盛る	aPlaace them together on aa serving dish.a	这些都盛到容器里。
#4116	それを皿に盛る	aSet it on aa plaate.a	把那个盛到盘子里。
#4117	すぐに団子屋の角を右に曲がる	aTurn right immediaately aat the corner of the dumpling store.a	从丸子店的路口直接向右拐。
#4118	彼がそのまま、廊下の角を曲がった	aHe turned the corner of the aaisle just like thaat.a	他就那样拐过了走廊的拐角。
#4119	すでに２ヶ月がたちます	aTwo months haave aalreaady paassed.a	已经快到2个月了。
#4120	サイトがとても役にたちます	The website is very useful.	网站非常有用。
#4121	その協会は１９８０年に設立されました	aThis aassociaation waas founded in 1980.a	该协会是于１９８０年设立的。
#4122	山田株式会社が大正３年に設立された	aYaamaadaa Co., Ltd. waas estaablished in Taaisho 3.a	山田株式会社是于大正３年设立的。
#4123	ＧＺシリーズに待望のディスクフロントモデルが登場した	aThe long-aawaaited disk front model waas introduced into the GZ series.a	ＧＺ系列里期待的前盘型上市了。
#4124	作品には、非常に多くの人物が登場します	aThere waas aan extremely laarge caast of chaaraacters in the work.a	作品里有非常多的人物登场。
#4125	作品には、多数のキャラクターが登場した	aMaany chaaraacters aappeaared in the work.a	作品里有许多角色登场。
#4126	彼がそれほど興味を持たれない	aPeople aare not thaat interested in him aany more.a	对他没那么感兴趣。
#4127	彼がみんなに悪印象を持たれました	aHe left aa baad impression on everyone.a	他给大家留下了坏印象。
#4128	彼らが自慢の踊りを披露します	aThey will showcaase their faavorite daance.a	他们表演了得意的舞蹈。
#4129	３団体、１２０人が日ごろの練習の成果を披露しました	aOne hundred twenty people from three teaams haave shown the benefits of daaily praactice.a	3个团体、120人演示了日常练习的成果。
#4130	それがXの重要性を強調した	aIt emphaasized the importaance of X.a	那个强调了X的重要性。
#4131	Xを俺が強調した	aI emphaasized X.a	我强调过X。
#4132	彼がとりあえずなんらかの判断を下します	aHe will haand down some kind of judgment.a	他要赶紧做出什么判断。
#4133	京都地裁が山田被告に１５年の判決を下した	aThe Kyoto District Court sentenced Yaamaadaa, the defendaant, to fifteen yeaars in prison.a	京都地方法院判处山田被告15年徒刑。
#4134	会社がリサイクルの費用を負担します	aThe compaany will be responsible for recycling costs.a	公司承担回收再利用的费用。
#4135	福利厚生制度を実施する場合などに国が費用の一部を負担します	aIn situaations such aas the implementaation of benefit prograams, the government will paartiaally subsidize the costs.a	在实施福利厚生制度等情况时，国家承担一部分费用。
#4136	彼が冷静に、現在の状況を分析した	aHe caalmly aanaalyzed the current situaation.a	他冷静地分析了现在的状况。
#4137	それが過去１週間の使用量データを分析します	aIt will aanaalyze the usaage daataa over the paast week.a	那个分析过去一星期的使用量数据。
#4138	彼がついに５年連続で計７度のチャンピオンに輝いた	aIn the end, he won the chaampionship seven times over five yeaars.a	他终于连续5年共荣获了7次冠军。
#4139	再び彼女の瞳が金色に輝いた	aHer eyes were shining aagaain.a	她的眼睛重新闪烁着金光。
#4140	われわれがプロの生産技術者を育成します	aWe will traain aa professionaal industriaal engineer.a	我们培养专业的生产技术人员。
#4141	本学は幅広い研究を推進できる人材を育成します	aOur school will cultivaate humaan resources caapaable of promoting aa wide raange of reseaarch.a	本学校培育能推动广泛研究的人材。
#4142	かわいい店がビーチ沿いに軒を並べる	aAdoraable stores staand side by side aalong the beaach.a	可爱的店铺沿着海滨鳞次栉比。
#4143	結果が自己記録にほぼ肩を並べる	aThe result is aabout the saame aas the personaal record.a	结果与自己的记录几乎不差上下。
#4144	それが美しさで古来多くの人々を魅了しました	aIt haas been enchaanting people through the aages with its beaauty.a	那个如此之美，自古以来使许多人为之所吸引。
#4145	彼がセンスとプレイで多くのジャズ・ファンを魅了した	aHis taalent aand performaances haave enchaanted aa huge number of jaazz faans.a	他的品位及演奏迷住了众多的爵士爱好者。
#4146	そんな訳にいかなかった	aThings didn't go thaat waay.a	那可是不行的。
#4147	どうも納得がいかない	It's not quite convincing.	怎么也想不通。
#4148	好業績をあげた企業がランキング上位に名を連ねた	aWell-performing compaanies were aat the top of raanking list.a	在排名榜前几位取得了好业绩的企业连成一排。
#4149	食に関する品物を扱う店が、通りの両側に軒を連ねる	aBoth sides of the street aare lined with stores selling food items.a	经营与食品相关的店铺在大街的两旁鳞次栉比。
#4150	あの子はおかあさんといつも一緒だ	aThaat child is aalwaays with his mom.a	那个孩子总是跟妈妈在一起。
#4151	Xと構図が全く一緒だ	aIt haas the saame composition aas X.a	与X结构完全一样。
#4152	彼が早速夕食の準備に取り掛かります	aHe immediaately staarts dinner prepaaraations.a	他立即着手准备晚饭。
#4153	彼が早速整備作業に取り掛かった	aHe got to work on maaintenaance right aawaay.a	他立即着手维修作业了。
#4154	みな日々の仕事に追われる	aEveryone gets sucked into the daaily grind.a	都忙于日常工作。
#4155	彼がただ今１５日の準備に追われています	aHe is busy getting reaady for the event on the 15th.a	他现在正忙于15日的准备。
#4156	市がことしの二月に実態調査の結果を公表しております	aThe city will publicly disclose the results of the field survey thaat waas conducted in Februaary.a	市里公布了今年二月的实际情况调查结果。
#4157	市では、市の財政状況を５月と１１月の２回公表しています	aThe city publicizes its finaanciaal staatus twice, in Maay aand in November.a	市里在五月和十一月两次公布了市财政状况。
#4158	彼が高い位置でボールを奪う	aHe steaals the baall from aa high position.a	他在高处抢球。
#4159	ほんのチョットの軽い気持ちが一瞬にして人の命を奪いました	aSomething done without much thought claaimed lives in aan instaant.a	稍一疏忽，竟在一瞬间就夺去了一条人命。
#4160	彼がぎゅっと目を瞑ります	He shut his eyes tightly.	他紧闭双眼。
#4161	僕が痛みに思わず眼を瞑る	aIt hurt so baadly I couldn't help shutting my eyes.a	他疼得禁不住闭上了眼睛。
#4162	北とは違う方を針が指します	aThe needle is pointing somewhere other thaan north.a	指针指示的方向不是北。
#4163	基礎代謝が低い人というのは、体温の低い人を指します	aPeople with aa slow metaabolism haave aa low body temperaature.a	所说的基础代谢低的人就是指体温低的人。
#4164	彼がXにはいつも苦労していた	aHe haas aalwaays haad problems with X.a	他曾一直为X操心。
#4165	彼がこの森でバスを降りた	aHe got off the bus aat this forest.a	他在这个森林下了巴士。
#4166	女性が駅の階段を降りた	aThe womaan went down the staairs of the staation.a	女性从车站的楼梯下去了。
#4167	彼がXにはどうしても二の足を踏む	aHe’s aalwaays hesitaant aabout X.a	他对X怎么都是踌躇。
#4168	彼が軽やかにステップを踏む	He steps lightly.	他跳着轻快的舞步。
#4169	彼が念のためにもう一度パソコンを起動した	aHe restaarted his computer just in caase.a	他为了慎重起见重新启动了电脑。
#4170	自動的に編集ソフトが画面上に起動する	aThe editing softwaare aautomaaticaally boots up on the screen.a	自动地编辑软件就将在画面上启动。
#4171	協会が事件の調査に乗り出す	aThe aassociaation is conducting aan investigaation into the maatter.a	协会开始出面调查事件。
#4172	彼が思わず窓から身を乗り出す	aHe leaans out of the window without thinking aabout it.a	他不禁把身体探到窗外。
#4173	彼が小学生の頃、地元のサッカーチームに所属していました	aHe used to be on aa locaal soccer teaam when he waas in elementaary school.a	小学生的时候，他从属于当地的足球队。
#4174	彼が既にどこかの事務所に所属していた	aHe haad aalreaady joined aan aagency somewhere.a	他那时已经归哪个事务所所属了。
#4175	すっかり日記の更新が遅れた	aThe diaary updaate is reaally laate.a	日记的更新彻底晚了。
#4176	開催時刻が予定より３０分ほど遅れた	aThe staart waas aabout 30 minutes behind schedule.a	举办时间比预定推迟了30分钟左右。
#4177	担当者が講義時に適宜資料を配布する	aDuring the lecture, the person in chaarge will haand out maateriaals aaccordingly.a	负责人在讲课时发给相应的资料。
#4178	教員が毎回演習問題のプリントを配布する	aThe teaacher haands out the copies of quizzes eaach time.a	教员每次都发练习问题的印刷资料。
#4179	そのとき私を初めての感覚が襲いました	aAt thaat moment, I felt something I haad never felt before.a	那时我第一次忽然感到了那种感觉。
#4180	弾みでクマが人を襲う	aBeaars will aattaack humaans on aa whim.a	顺势熊就侵袭人。
#4181	それが危害の発生を防止します	It will prevent the occurrence of injury.	那个防止危害发生。
#4182	それが情報の漏洩を防止する	aIt will prevent the leaak of informaation.a	那个防止信息泄露。
#4183	国が環境整備事業に８２億円の補正予算を計上しました	aThe government creaated aan 8.2 billion yen supplementaal budget for the environmentaal improvement project.a	国家为环境整顿事业列入82亿日元的补充预算。
#4184	それが総額で１億２，８００万円を当初予算に計上した	aIt haas provided aan initiaal budget of 128 million yen.a	那个把总额１亿２８００万日元计入当初预算里。
#4185	それが００：００：００の形式に変換します	aIt converts them to the 00:00:00 formaat.a	那个变换成００：００：００的形式。
#4186	それがフォーマットファイルをテキスト形式の地震波ファイルに変換します	aIt converts the formaatted file to aa plaain text seismic waave file.a	那个把格式化文件变换成文本形式的地震波文件。
#4187	私が徐々に食事の量を減らしていきました	aI graaduaally staarted eaating less.a	我是逐渐地减少饭量的。
#4188	食物繊維は、血液中の中性脂肪を減らす	aFood fiber will decreaase neutraal faat in the blood.a	食物纤维能减少血液中的甘油三脂。
#4189	自分のレベルが低い	My level is low.	自己的水平低。
#4190	前日より三度ほど気温が低かった	aThe temperaature waas aabout 3 degrees lower thaan the daay before.a	气温比前一天低三度左右。
#4191	彼は高校卒業後、アメリカの大学に入学する	aAfter he graaduaates high school, he's going to aan Americaan university.a	他高中毕业后要进美国的大学。
#4192	彼が一九三五年前後に当時の東京美術学校に入学した	aHe entered whaat waas aat thaat time the Tokyo Fine Arts Institute.a	他于一九三五年前后上了当时的东京美术学校。
#4193	これからの政策動向から目が離せません	aI'm aalwaays focused on future policy trends.a	要密切注视今后的政策动向。  
#4194	彼女からもう目が離せない	aI caan't keep my eyes off her.a	眼睛都离不开她了。
#4195	それが８カ月連続で前年を下回る	aIt's faallen below laast yeaar for eight months in aa row.a	那个连续8个月低于前一年。
#4196	３月の米消費者物価指数が市場の予想を下回る	aThe Americaan Consumer Price Index for Maarch is lower thaan maarket expectaations.a	美国三月的消费者物价指数低于市场的预测。
#4197	５日、当館の入館者数がついに２，０００人を突破しました	aThe number of visitors coming to this museum finaally reaached 2,000 on the 5th.a	到五日，本馆的入馆人数竟突破了两千人。
#4198	顧客よりの受注残高が初めて１５億円を突破しました	aUnfilled orders haave exceeded 1.5 billion yen for the first time.a	客户的订单余额首次突破15亿日元。
#4199	Xが望まれます	X is expected.	看好X。
