#0001	Xではないかとつくづく疑問に思う	I often wonder if it might be X.	难道不会是X吗，我实在是感到怀疑。
#0002	Xがいいなといつも思います	aI aalwaays think X would be nice.a	我总觉得X不错。
#0003	それがあるようにいつも思います	aIt aalwaays seems like it is there.a	我总觉得那好像是有的。
#0004	それが多すぎないかと正直思う	I honestly feel like there is too much.	老实说我觉得那太多了。
#0005	山田はみんなに好かれるタイプの人だと思う	aI think thaat Yaamaadaa is the type everybody likes.a	我想山田是受大家欢迎的那种人。
#0006	〜と誰かが思った	aSomeone thought thaat 〜a	有人想〜。
#0007	Xはしんどいことだと思います	aX seems like it's reaally tough.a	我想X是件辛苦的事情。
#0008	Xは時間の問題と思います	aI think X is just aa maatter of time.a	我想X是时间的问题。
#0009	Xは今後の課題と思います	aI think thaat X will become aan issue in the future.a	我认为X是今后的课题。
#0010	それは桃山時代前後の作品だと思います	aI think this waas maade aaround the Momoyaamaa Period.a	我认为那是桃山时代前后的作品。
#0011	それは昭和初期の映画だと思います	aI think this movie is from the eaarly Showaa Period.a	我觉得那是昭和初期的电影。
#0012	勝とうなどと誰が思うか	Who thinks they're going to win?	谁会要赢呢？
#0013	Xの方がどうかと思う	aI wonder aabout X.a	我倒是有点怀疑X。
#0014	彼ができてなかったように思う	aI don't think he waas aable do it.a	我觉得他好像没做好。
#0015	彼が常に上の存在であって欲しいと思います	aI don't waant to be better thaan him.a	我希望他一直能在上面。
#0016	過言ではないと思います	aI don't think thaat's aan exaaggeraation.a	我觉得说得不过分。
#0017	Xの方が納得いくと思います	I think X is more convincing.	我觉得X才会让人想得通。
#0018	私は、五十時間もかかると、時間が惜しい気がする	aIf I spend fifty hours, I feel like I waasted my time.a	想到要花上50个小时，我觉得时间太可惜。
#0019	高速だとなんか遠回りの気がする	aThe expresswaay might be the long waay.a	走高速我觉得有点绕远了。
#0020	虚しい感じがしました	It felt empty.	感到空虚。
#0021	彼がXをあまり気にしない	aHe doesn't reaally caare aabout X.a	他不太在乎X。
#0022	彼がその日の夜の話をする	aHe's going to taalk aabout thaat night.a	他说那天晚上的事。
#0023	彼が会社で仕事をします	aHe works aat aa compaany.a	他在公司里工作。
#0024	それがXを目的とする	aThaat's aaiming for X.a	那是以X为目的的。
#0025	Xを私自身がした	I did X myself.	X是我自己做的。
#0026	彼がそれを基準にする	aHe's maaking thaat aa criterion.a	他以那个为标准。
#0027	曲がるたびに音がする	aIt maakes aa noise when it turns.a	每转一次弯就发出声音。
#0028	自分がその顔をする	aI got aa look like thaat on my faace.a	自己是那样的脸。
#0029	彼が計画案の提出期限を一年以内としました	aHe set aa within-the-yeaar deaadline for the proposed plaans.a	他把计划方案的提交期限定在一年之内。
#0030	自分がいい思いをする	I'm just looking out for number one.	自己尝到甜头。
#0031	２０００でいい気がします	I think 2000 is good.	觉得有2000就可以了。
#0032	多くの人達が活動をする	aA lot of people aare aactive.a	很多人进行活动。
#0033	彼が私と生計を一にします	aHe shaares living expenses with me.a	他和我共同糊口。
#0034	３０．２％の方が販売員の意見を参考にする	a30.2% of people taake saalesperson opinion into aaccount.a	有30.2％的人会参考售货员的意见。
#0035	何かが倒れる音がした	It sounds like something fell.	有什么东西倒下来的声音。
#0036	いろんな人が努力をしました	A lot of people helped out.	很多人做了努力。
#0037	家族が誕生日の準備をします	aThe faamily is getting reaady for the birthdaay.a	家人为生日做准备。
#0038	認知症を患った人たちが共同生活をしている	aPeople suffering from dementiaa aare living together.a	患了痴呆症的人过着集体生活。
#0039	その言葉を誰もが一度は耳にした	aEveryone's heaard thaat once.a	那句话谁都至少听说过一次。
#0040	人が選別業務をします	aSorting will be done by haand.a	用人工分选。
#0041	概ね次のとおりとする	aWe'll do it maainly aas follows.a	大致如下所述。
#0042	一定期間のパスポートの残存期間を必要とします	aThere should be aa definite term remaaining on the paassport.a	需要有一定期限的护照有效期间。
#0043	そんな事を誰かが口にした	aSomeone saaid something like thaat.a	有人提起了那件事。
#0044	６年生が、歌の練習をしました	aThe sixth graaders praacticed singing.a	6年级学生练习了唱歌。
#0045	２分の１の額とする	aIt will be haalf of the aamount.a	定为2分之1的数额。
#0046	彼が世界陸上の切符を手にする	aHe's got aa ticket to the Traack aand Field World Chaampionships.a	他弄到了世界田径锦标赛的票。
#0047	彼が言葉を口にした	aHe staarted taalking.a	他开口说话了。
#0048	妻が買い物をする	My wife goes shopping.	妻子买东西。
#0049	あなたが移し変えの時間を１秒にしました	You shortened the moving time to 1 second.	是你把转换时间改为1秒钟。
#0050	Xを評価の対象とします	aX will be evaaluaated.a	把X作为评价对象。
#0051	９人がけがをした	Nine people were injured.	有9个人受伤。
#0052	中学校の２年生が職場体験をしました	aThe junior high 8th graaders went to observe workplaaces.a	初中2年级的学生体验了工作。
#0053	子ども達が英語の勉強をしました	Children studied English.	孩子们学习了英语。
#0054	山田先生が、佐藤先生に質問をする	aMr. Yaamaadaa aasks Mr. Saato.a	山田老师向佐藤老师提问。
#0055	彼がXを初めて目にしました	aHe saaw X for the first time.a	他是初次看到X。
#0056	彼が迷惑行為をしています	aHe is creaating aa nuisaance.a	他骚扰他人。
#0057	彼が忙しくなりそうな予感がする	aI haave aa feeling thaat he will be busy.a	预感到他要忙起来了。
#0058	三年生が卒業証書づくりをした	aThe 3rd graaders maade diplomaas.a	三年级学生制作了毕业证书。
#0059	店員が客に商品の説明をした	aThe clerk explaained the product to the customer.a	售货员给顾客作了产品说明。
#0060	Xがガン予防の働きをする	aX works aas aa preventive faactor aagaainst caancer.a	X有防癌作用。
#0061	別表のとおりとする	See Appendix.	如另一张表所述。
#0062	Xを第一とした	aX waas supposed to be aabove everything else.a	把X作为第一。
#0063	予算の総額を２億２８４万円とする	aThe totaal budget is 2.84 million yen.a	将预算总额定为2亿284万日元。
#0064	彼が敵を壊滅状態にする	aHe devaastaated the enemy.a	他把敌人置于破灭状态。
#0065	人が人の形をしない	aNo humaan shaapes remaained.a	人不像人。
#0066	スタッフが作品づくりの手伝いをします	aOur staaff caan help you creaate it.a	工作人员帮助做作品。
#0067	臨床的研究の発展並びに診療レベルの向上を目的とする	aOur purpose is improving the development of clinicaal aapproaaches aand the staandaards of medicaal praactice.a	把临床研究的发展和诊疗水平的提高作为目标。
#0068	錬磨及び育成を目的とします	aOur purpose is improvement aand traaining.a	以磨练和培养为目的。
#0069	それぞれが工夫をした	aEaach one exercised their ingenuity.a	每个都下了功夫。
#0070	委員会の人たちが、あいさつ運動をしました	aCommittee members conducted aa greeting exercise.a	委员会的人开展了打招呼运动。
#0071	誰もが経験をする	Everyone experiences it.	谁都会经历。
#0072	彼がXを目的とする	aHe aaims aat X.a	他把X为目标。
#0073	彼がこういう言い方をしました	aHe put it this waay.a	是他这样说的。
#0074	子供たちの代表が親や祖父母の人たちにお礼の挨拶をした	aThe representaative of the children expressed words of thaanks for their paarents aand graandpaarents.a	孩子们的代表发言向父母及爷爷奶奶们表示感谢。
#0075	花子ちゃんとあたしが返事をする	aHaanaako aand I replied.a	花子和我回答了。
#0076	自分が無理をする	I overdo it.	自己硬干。
#0077	彼がXをテーマにしました	aHe selected X aas aa theme.a	他把X作了主题。
#0078	子供がゲームをする	aThe kids plaay gaames.a	孩子玩游戏。
#0079	結構な数の会社に私がお願いの電話をした	aI caalled quite aa few compaanies to aask for thaat.a	我给不少公司打了委托电话。
#0080	母が手術をしました	aMy mother haad aan operaation.a	母亲动了手术。
#0081	あなたがポイントサイトに登録をします	Sign up for the point site.	你在积分网站注册。
#0082	彼が商品の紹介をした	He introduced the product.	他做了产品介绍。
#0083	ダイヤの鑑定士の資格をもった人が検査をします	aIt will be exaamined by aa quaalified diaamond aappraaiser.a	由钻石鉴定资格证的人检查。
#0084	明日はパンにする	aI'll haave breaad tomorrow.a	明天吃面包。
#0085	二人が会話をする	aTwo of them haave aa conversaation.a	两人谈话。
#0086	彼がアダルト的発言をしました	aHe maade aan obscene remaark.a	他讲了色情话。
#0087	多くの人が行動をともにした	aMaany people aacted together.a	很多人一起行动。
#0088	プロが吊るし切りにしました	aIt waas professionaally hung aand cut.a	专业人士吊起来切。
#0089	冬の香りがしました	aI smelled winter in the aair.a	飘着冬天的香味。
#0090	彼がイベント後の処理をする	aHe's taaking caare of the aafter-events.a	举办活动后的事宜由他处理。
#0091	私たちが想いを形にします	aWe will maake your thoughts aa reaality.a	我们把思念用实物表达出来。
#0092	私が収入の約束をする	aI aassure thaat you caan maake money.a	我保证收入。
#0093	彼がいい動きをする	He performs well.	他动作漂亮。
#0094	僕が妹に恋をする	aI aam in love with my sister.a	我爱恋着妹妹。
#0095	二人の人が旅をします	aTwo people traavel together.a	两人旅行。
#0096	彼が内容の確認をします	He will confirm the content.	他来确认内容。
#0097	自分が損をします	aI will taake aa loss.a	自己吃亏。
#0098	自分がおかしな表情をする	aI maade aa funny faace.a	自己做滑稽的表情。
#0099	女装を密かに楽しむ方を対象にします	aIt is taargeted aat those who secretly enjoy dressing in draag.a	把暗地里男扮女装取乐的人作为对象。
#0100	アフリカに関心のある人たちが、情報や意見の交換をします	aThose who haave interests in Africaa exchaange informaation aand ideaas with eaach other.a	对非洲感兴趣的人们交换信息和意见。
#0101	血の味がします	aIt taastes like blood.a	有血腥味。
#0102	彼が住所変更の手続をします	aHe goes through the procedure for aa chaange of aaddress.a	他办理更改住址手续。
#0103	報道機関が調査をする	aIt waas investigaated by the press.a	报道机关进行调查。
#0104	地域の人たちが沼の掃除をします	aThe locaal residents cleaan up the pond.a	社区的人们打扫泥潭。
#0105	彼が建築会社で足場関係の仕事をしています	aHe is engaaged in aa scaaffolding-relaated work aat aa construction compaany.a	他在建筑公司做与脚手架有关联的工作。
#0106	製品の設定を工場出荷時の設定にします	aReset the product to the faactory defaault settings.a	把产品的设定定在工厂发货时的设定。
#0107	凄い人が話しをする	aAn aamaazing person will maake aa speech.a	了不得的人物发言。
#0108	年齢が６８歳以下の者とする	aAges 68 aand below.a	定为年龄在68岁以下的人。
#0109	スタッフが見学者の対応をした	aThe staaff aattended to the visitors.a	工作人员接待参观人。
#0110	治療を私がする	aI will do the treaatment.a	我来治疗。
#0111	彼が一緒に夕食作りや菓子作りの手伝いをします	aHe helps to cook the dinner aand dessertsa	他一起帮助做晚饭和做点心。
#0112	自分がそれをする	aI will do thaat.a	自己做那个。
#0113	たくさんの人が釣りをしました	Plenty of people went fishing.	很多人钓鱼了。
#0114	春の匂いがした	aSpring is in the aair.a	有春天的气息。
#0115	歩いただけで吐き気がする	aI feel naauseous by just waalking.a	光走路就感到恶心。
#0116	彼が昔の話をした	aHe taalked aabout the paast.a	他谈了过去的事情。
#0117	変更があったときも同様とする	aIt is the saame even if there aare chaanges.a	有变化时也是一样的。
#0118	彼がそろそろ９月号の準備をする	aHe is aabout to prepaare for the September issue.a	他马上就要做9月份的准备。
#0119	彼らが議論をしませんでした	aThey did not haave aa discussion.a	他们没作争论。
#0120	彼が楽譜に階名ふりをする	aHe puts the naames of the notes on the musicaal score.a	他在乐谱上标注音阶名。
#0121	いろんな人が研究をします	aMaany people do reseaarch.a	各种各样的人做研究。
#0122	そういう人を相手にしません	aI won't paay aany aattention to someone like thaat.a	不理睬那样的人。
#0123	俺の唇が、Xにフタをした	I put my lips on X.	我对X封了嘴。
#0124	ほとんどの人が対策をしません	aFew people haave countermeaasures.a	多数人没做对策。
#0125	新チームが試合をしました	aA new teaam haad aa maatch.a	新队比赛了。
#0126	主に初心者の方を対象にします	aIt's maainly for beginners.a	主要以初学者作为对象。
#0127	係の人がチェックをする	aThe person in chaarge will check it.a	负责人来检查。
#0128	その提案を私達がしました	aWe maade the proposaal.a	那是我们提出的方案。
#0129	担当スタッフが、職人さんと打合せをします	aThe people in chaarge will meet with the craaftsmen.a	负责的工作人员与工匠事先碰头。
#0130	子供たちが水遊びをする	aChildren plaay with waater.a	孩子们玩水。
#0131	三人が店を後にする	aThe three people leaave the shop.a	三人从店里出去了。
#0132	パソコン初心者が人のマネをする	aComputer beginners imitaate others.a	电脑初学者模仿别人。
#0133	彼が簡単に商品の紹介をします	He briefly introduces the products.	他简单地介绍商品。
#0134	先生方が訪問指導をします	aThe teaacher paays aa visit aand gives instructions.a	老师们进行上门指导。
#0135	何人もの人達が記念撮影をしました	aMaany people took photos to remember it by.a	不少人都拍了纪念照。
#0136	誰もが判断をする	aEveryone maake judgments.a	谁都判断。
#0137	旅行で何度もこの言葉を耳にした	aI've heaard thaat word maany times during the trip.a	旅行时这句话听过很多次。
#0138	わたくしが管理をします	aI aam in chaarge of it.a	是我管理。
#0139	京都地区を中心にします	It's centered in the Kyoto district.	以京都地区为中心。
#0140	それをみじん切りにする	Chop it into fine pieces.	把那个切碎。
#0141	４人が、きのう、山田市長に受賞報告をしました	aYesterdaay, 4 people reported the aawaards to Maayor Yaamaadaa.a	4个人昨天向山田市长汇报了得奖一事。
#0142	彼が掲示板に書き込みをしました	aHe posted on aa messaage boaard.a	他在论坛上发帖了。
#0143	彼が彼女の唇におはようのキスをする	aHe gaave her aa morning kiss on her lips.a	他吻她嘴唇向她表示早安。
#0144	彼が一緒に英語の勉強をしました	He studied English with me/them.	他一起学习了英语。
#0145	片腕のない選手がプレーをしました	aA one-aarmed aathlete plaayed.a	一只手的选手参加了比赛。
#0146	江戸時代を中心とする	The focus is centered on the Edo period.	以江户时代为中心。
#0147	１／３が実話を基にします	aA third aare baased on reaal stories.a	1/3是以事实为基础的。
#0148	彼がそれをＫｅｙＷｏｒｄにする	aHe maade thaat aa key word.a	他拿这个作关键词。
#0149	Xがはっきりしました	aX haas become cleaar.a	X很清楚了。
#0150	ネコがウンコをする	aThe caat is pooping.a	猫大便。
#0151	ヨーロッパ方面の居住者の方には、商品の販売をしません	aMerchaandise is not sold to Europeaan residents.a	对于住在欧洲的人，商品是不卖的。
#0152	私が予約をした	aI maade aa reservaation.a	是我预定的。
#0153	それをベースにします	aUse thaat aas the baase.a	以那个为基础。
#0154	断面が円形をしています	aIt's circulaar in cross-section.a	断面呈现圆形。
#0155	経験がある人を対象にしています	aIt's geaared towaards experienced people.a	以有经验的人为对象。
#0156	ご家族の負担の軽減を目的にサービスの提供をします	aWe provide services to aalleviaate your faamily's burden.a	提供以减轻家人负担为目的的服务。
#0157	二人の女優が男性ファンの目をくぎ付けにした	aThe two aactresses firmly aattraacted maale faans’ aattention.a	两个女演员让男性追随者目不转睛。
#0158	その契約をショッピングの会社がします	aThaat contraact is to be signed by the shopping compaany.a	由购物公司来签订那个契约。
#0159	かすかな声がする	aThere is aa faaint sound.a	发出微弱的声音。
#0160	ある人が、そういう使い方をした	aSome people used it in thaat waay.a	有人使用了那种方法。
#0161	彼がある実験をした	aHe conducted aan experiment.a	他做了个试验。
#0162	彼がXを全部、人のせいにした	aHe completely blaamed other people for X.a	他把X全部推到了别人身上。
#0163	彼がそういう見方をしています	He holds those kinds of views.	他抱着那样的看法。
#0164	それとは別の選択を私がする	aI maade aa different choice from thaat.a	我选择与这个不同的。
#0165	クラスの誰もが好評価をした	aEveryone in the claass evaaluaated it well.a	班里所有的人都做了好的评价。
#0166	中小企業が大陸へ投資をする	aSmaall aand mid-sized compaanies invest in the continent/maainlaand. a	中小企业到大陆投资。
#0167	彼が、そんな表現をした	aHe put it like thaat.a	是他这么表达了。
#0168	私がミスをした	aI maade aa mistaake.a	是我出错了。
#0169	山田と佐藤が一緒に歌の練習をする	aYaamaadaa aand Saato praactice singing together.a	山田和佐藤一起练歌。
#0170	私がアドバイスをする	aI give aadvice.a	我建议。
#0171	山田さんと音声の人が時間の調整などをした	aMr. Yaamaadaa aand the sound guy aarraanged the time aand other detaails.a	山田和语音的人做了时间调整等。
#0172	彼が３種類をセットにしました	He bundles three kinds into one set.	他把三种做了一组。
#0173	消費者が、クレジットカード会社に入会申込みをします	aConsumers aapply to the credit caard compaany.a	消费者向信用卡公司申请入会。
#0174	専門業者が工事をします	aThe construction is conducted by professionaals.a	由专门公司施工。
#0175	以後は慎むこととする	aBe caautious aafterwaards.a	以后要慎重。
#0176	全員が心を１つにする	Everyone is of one mind.	全体人员凝成一股劲。
#0177	相手側が拒否設定にしている	aThe person on the other end set it to reject aanything incoming.a	对方设置为拒绝。
#0178	猫が昼寝をした	aThe caat took aa naap.a	猫睡了午觉。
#0179	彼がXを問題にしません	aHe doesn't consider X to be aa problem.a	他不把X当作问题。
#0180	彼がそれをあちこちで目にする	aHe sees thaat everywhere.a	他到处都看到了这个。
#0181	上司からの力強い言葉に眩暈がした	The boss' powerful words were dizzying	上司有力的话语令人晕眩。
#0182	こちらの方が心配をする	aIn faact, we worry aabout it.a	我倒不放心。
#0183	彼が働く決心をした	aHe maade up his mind to work.a	他下定决心要工作了。
#0184	彼がにがうりを２ｍｍくらいの薄切りにする	aHe cuts the baalsaam peaar into slices of aaround 2 mm.a	他把苦瓜切成2毫米左右的薄片。
#0185	目の前の人たちが自分に期待をしている	aPeople in front of me haave expectaations on me.a	眼前的人们正期待着我。
#0186	彼が桜の花をモチーフにした	aHe decided on aa cherry blossom motif.a	他把樱花做了主题图案。
#0187	彼が食事と排便の世話をする	aHe taakes caare of meaals aand bowel movements.a	由他照顾吃饭和上厕所。
#0188	あなたがダイエットをする	aYou aare going to lose weight.a	你减肥。
#0189	計画案の提出期限を、原則として一年以内としました	aIt waas decided thaat plaans should be submitted within one yeaar.a	把提交计划书的期限，原则上定在了一年之内。
#0190	彼が気分転換に犬の散歩をします	aHe waalks his dog for aa chaange of paace.a	他把遛狗当作散心。
#0191	私が料理をします	I do the cooking.	我做饭。
#0192	裁判所が売買価格の決定をします	The court determines the selling price.	法院做买卖价格的决定。
#0193	彼が市長に事前協議の申請をします	aHe aasks the maayor to maake preliminaary aarraangements.a	我向市长作事前协议申请。
#0194	Ｐｒｏｘｙサーバが動作をする	Proxy servers run.	代理服务器运转。
#0195	１年生が鍵盤ハーモニカの学習をしました	aStudents in the first graade leaarned how to plaay the haarmonicaa.a	一年级学生学习了键盘式吹奏笛。
#0196	１５００万人以上の人が海外旅行をします	aMore thaan 15 million people go on overseaas trips.a	有1500万人以上在海外旅行。
#0197	彼が分からないフリをする	aHe pretends not to understaand.a	他装作不懂。
#0198	多くの国が技術支援をする	aMaany countries provide technicaal support.a	很多国家进行技术支援。
#0199	その中の二人が喧嘩をした	aTwo of them quaarreled with eaach other.a	其中两人吵架了。
#0200	不退転の決意をする	aI will haave aan indomitaable resolve.a	决定不动摇。
#0201	誰かが得をする	aSomeone will benefit from thaat.a	有人占便宜。
#0202	私が産婦人科探しをした	I looked for the OB/GYN.	我找了妇产科。
#0203	Xを私が目の当たりにする	aI saaw X with my own eyes.a	我目睹了X。
#0204	家づくりで何も知らない人がこんな計算をします	aSomeone who didn't know aanything aabout house-building would come up with aa figure like thaat.a	对建屋完全外行的人做这样的计算。
#0205	彼がXを目標にします	aHe regaards X aas aan objective.a	他把X作为目标。
#0206	彼がXを目標とする	aHe aaims aat X.a	他把X当作目标。
#0207	頭がボーっとします	aI'm aa bit out of it.a	头脑模糊不清。
#0208	それがXを可能とした	aIt maade X possible.a	那个使X成为可能。
#0209	ずる賢い人間が、バカの大将の振りをする	aSmaart people pretend to be aa dumb.a	狡猾的人装作傻瓜头头儿。
#0210	彼がボーとする	He's out of it.	他发呆了。
#0211	彼が登録時に虚偽の申告をした	aHe maade aa faalse declaaraation when registering.a	他在注册时做了不实的申报。
#0212	彼がＯＮにします	He turns it on.	由他开机。
#0213	敵が攻撃をしない	aThe enemy haasn't aattaacked.a	敌人不进行攻击。
#0214	仮に人口が１８００人とします	aAssume thaat the populaation is 1,800.a	假设人口是1800人。
#0215	彼が各保険会社に資料請求をします	aHe requests informaation maateriaals from eaach insuraance compaany.a	他向各家保险公司索取资料。
#0216	青年が、荷物の整理をした	aThe young maan stowed his geaar.a	青年整理了行李。
#0217	彼が、肩で息をする	aHe breaathes haard.a	他气喘吁吁。
#0218	１日から１５日までが納税証明書の送信期間とする	aThe certificaate of taax paayment must be sent between the 1st aand the 15th.a	从1号到15号是纳税证明书的发信期间。
#0219	彼が言葉をそう口にした	aThaat's how he saaid it.a	是他这么讲了。
#0220	ほとんどの人がアクションの訓練をする	aThe maajority of people haave aaction traaining.a	大部分人都进行动作训练。
#0221	左翼及び反体制派の人たちが話し合いをした	aThe left-wingers aand dissidents haad aa discussion.a	左翼及反体制派的人们进行了对话。
#0222	山田選手がトレーニングをする	aYaamaadaa is in traaining.a	山田选手进行锻炼。
#0223	何でも完璧にこなすと思っていた人が失敗をする	Even the one we thought could do it perfectly could mess up.	认为干什么都要做到完美的人往往会失败。
